Date,Content,URL,Thread
"Jun-23-2023, 05:41:47","polish women would rather fuck a pajeet than a hard working polish man we're getting hundreds of thousands of shitskins these days so ""our"" women should be content with that situation - they won't have to travel abroad to betray their race like that whore who fortunately got raped and killed in greece the other day short indian picks up hot girls in warsaw, poland https://www.youtube.com/watch?v=vwvchrx5uui",http://boards.4chan.org/bant/thread/17928132/manlet-pajeets-stealing-polish-women#p17928132,manlet_pajeets_stealing_Polish_women
"Jun-23-2023, 05:43:17",it's about time cocky polacks get hated like never before for their boasting about muh we will never let poland turn into decadent west here,http://boards.4chan.org/bant/thread/17928132/manlet-pajeets-stealing-polish-women#p17928133,manlet_pajeets_stealing_Polish_women
"Jun-23-2023, 05:44:03",support ukraine!! yay nato!!,http://boards.4chan.org/bant/thread/17928132/manlet-pajeets-stealing-polish-women#p17928134,manlet_pajeets_stealing_Polish_women
"Jun-23-2023, 05:44:30","trivia: polacks never actively fought against the invasion, it was just that our economy was too shit for people to want to move here",http://boards.4chan.org/bant/thread/17928132/manlet-pajeets-stealing-polish-women#p17928135,manlet_pajeets_stealing_Polish_women
"Jun-23-2023, 05:45:07",how all race mixers aka mutt dispensers should be dealt with.,http://boards.4chan.org/bant/thread/17928132/manlet-pajeets-stealing-polish-women#p17928136,manlet_pajeets_stealing_Polish_women
"Jun-23-2023, 05:49:20","pua shit works, thats why the system went into fanatic overdrive to destroy the whole movement.",http://boards.4chan.org/bant/thread/17928132/manlet-pajeets-stealing-polish-women#p17928137,manlet_pajeets_stealing_Polish_women
"Jun-23-2023, 05:55:03",then average polish man walks in,http://boards.4chan.org/bant/thread/17928132/manlet-pajeets-stealing-polish-women#p17928138,manlet_pajeets_stealing_Polish_women
"Jun-23-2023, 05:55:35",,http://boards.4chan.org/bant/thread/17928132/manlet-pajeets-stealing-polish-women#p17928139,manlet_pajeets_stealing_Polish_women
"Jun-23-2023, 05:56:36",works for me. kill yourself.,http://boards.4chan.org/bant/thread/17928132/manlet-pajeets-stealing-polish-women#p17928140,manlet_pajeets_stealing_Polish_women
"Jun-23-2023, 06:00:32","pua doesn't work unless you're a chad (see mystery's tv show, where only the chads were successful), and these faggots always eventually get caught out hiring girls for videos.",http://boards.4chan.org/bant/thread/17928132/manlet-pajeets-stealing-polish-women#p17928141,manlet_pajeets_stealing_Polish_women
"Jun-23-2023, 06:00:47",works for me,http://boards.4chan.org/bant/thread/17928132/manlet-pajeets-stealing-polish-women#p17928142,manlet_pajeets_stealing_Polish_women
"Jun-23-2023, 06:04:06",you will never be a woman. all women i have seen were visibly disgusted upon seeing pajeets and i had to stop my own mom from talking shit about them in public,http://boards.4chan.org/bant/thread/17928132/manlet-pajeets-stealing-polish-women#p17928143,manlet_pajeets_stealing_Polish_women
"Jun-23-2023, 06:22:08","i can't even imagine how retarded you have to be to believe any of those ""pick-up artist/dating coach"" videos, especially from a shitskin.",http://boards.4chan.org/bant/thread/17928132/manlet-pajeets-stealing-polish-women#p17928144,manlet_pajeets_stealing_Polish_women
"Jun-23-2023, 06:25:12","lol keep coping it's knows fact that polish whores fuck niggers and arabs, pajeets especially when i was in uk, same goes for latvian whores. muh based eastern europe",http://boards.4chan.org/bant/thread/17928132/manlet-pajeets-stealing-polish-women#p17928145,manlet_pajeets_stealing_Polish_women
"Jun-23-2023, 06:28:54","jewish women fuck bbc and bpc only, thats a fact you little jewish incel dicklet.",http://boards.4chan.org/bant/thread/17928132/manlet-pajeets-stealing-polish-women#p17928146,manlet_pajeets_stealing_Polish_women
"Jun-23-2023, 06:29:12",women only seem to respect violence so just beat the ever loving fuck out some brown bitch,http://boards.4chan.org/bant/thread/17928132/manlet-pajeets-stealing-polish-women#p17928147,manlet_pajeets_stealing_Polish_women
"Jun-23-2023, 06:37:33","lmao imagine having disgusting pictures like that on your pc, totally demented mind of a cuckold",http://boards.4chan.org/bant/thread/17928132/manlet-pajeets-stealing-polish-women#p17928148,manlet_pajeets_stealing_Polish_women
"Jun-23-2023, 06:38:33",i had a polish egf ama.,http://boards.4chan.org/bant/thread/17928132/manlet-pajeets-stealing-polish-women#p17928149,manlet_pajeets_stealing_Polish_women
"Jun-23-2023, 06:38:56","i live in poland most of the time - only the ugly by polish standards girls would actually sleep with these chapatis. most of them are exchange details to they can send screenshots to laugh with their friends. either that or they just want to practice their english. for some reason polish people are very insecure about their pronunciation / grammar when speaking english, so they jump on any opportunity to practice.  poland is still based and you only see chad foreigners with good jobs with actually decent looking gfs out there. i should know, i'm one of them.",http://boards.4chan.org/bant/thread/17928132/manlet-pajeets-stealing-polish-women#p17928150,manlet_pajeets_stealing_Polish_women
"Jun-23-2023, 06:39:15","you are mentally ill, kys. no wonder why no one wants you around",http://boards.4chan.org/bant/thread/17928132/manlet-pajeets-stealing-polish-women#p17928151,manlet_pajeets_stealing_Polish_women
"Jun-23-2023, 06:40:39","retarded coomer, i'm sure they do, the same with romanian whores, but never for free. you will never see an eastern european slut fuck a low status shitskins or niggers for free, maybe they could get lucky with an ugly reject, but never with atractive women you see in this type of videos. you retards don't have a clue how women work.",http://boards.4chan.org/bant/thread/17928132/manlet-pajeets-stealing-polish-women#p17928152,manlet_pajeets_stealing_Polish_women
"Jun-23-2023, 06:40:59",ugh are you a pajeet? how come you live in the uk and can't speak proper english?,http://boards.4chan.org/bant/thread/17928132/manlet-pajeets-stealing-polish-women#p17928153,manlet_pajeets_stealing_Polish_women
"Jun-23-2023, 06:42:41",based. finally we will get some diversity.,http://boards.4chan.org/bant/thread/17928132/manlet-pajeets-stealing-polish-women#p17928154,manlet_pajeets_stealing_Polish_women
"Jun-23-2023, 06:44:30",it's the adhd mate,http://boards.4chan.org/bant/thread/17928132/manlet-pajeets-stealing-polish-women#p17928155,manlet_pajeets_stealing_Polish_women
"Jun-23-2023, 06:45:50",kara boga sirs will inherit the world,http://boards.4chan.org/bant/thread/17928132/manlet-pajeets-stealing-polish-women#p17928156,manlet_pajeets_stealing_Polish_women
"Jun-23-2023, 06:48:12","i hate to admit it but poos do have their luck with eastern and central slavs, guess they just have a scat fetish for smelly, creepy and rude males that wobble their head in a comical way.",http://boards.4chan.org/bant/thread/17928132/manlet-pajeets-stealing-polish-women#p17928157,manlet_pajeets_stealing_Polish_women
"Jun-23-2023, 06:51:04","palestinian bvlls are coming for you nigga, prepare your jewish anus nigga",http://boards.4chan.org/bant/thread/17928132/manlet-pajeets-stealing-polish-women#p17928158,manlet_pajeets_stealing_Polish_women
"Jun-23-2023, 06:52:33","i'm not a tranny, it's just that polish women are whores trannies might as well all drop dead, i don't care",http://boards.4chan.org/bant/thread/17928132/manlet-pajeets-stealing-polish-women#p17928159,manlet_pajeets_stealing_Polish_women
"Jun-23-2023, 06:53:00","i believe it, because eastern europeans are low iq.",http://boards.4chan.org/bant/thread/17928132/manlet-pajeets-stealing-polish-women#p17928160,manlet_pajeets_stealing_Polish_women
"Jun-23-2023, 06:54:26",southern europeans have definitely lower iq than us but i don't hear about their women being such whores,http://boards.4chan.org/bant/thread/17928132/manlet-pajeets-stealing-polish-women#p17928161,manlet_pajeets_stealing_Polish_women
"Jun-23-2023, 06:56:38","oh hi justin! welcome to 4chan, the famous hacker! before you smear yourself with cow dung, let me tell you that you are full of shit yourself and need to go back, btw, those girls you ""picked"" up, they're 2/10. tops. however, even if they were 10/10, you would not achieve much when compared to an average white guy from anywhere in europe. enjoy your stay, don't spend too much on hookers and kys.",http://boards.4chan.org/bant/thread/17928132/manlet-pajeets-stealing-polish-women#p17928162,manlet_pajeets_stealing_Polish_women
"Jun-23-2023, 06:59:28","good point. maybe, they have historic/cultural xenophobia cultural norms, because of their various conflicts with dark shitskins instead of yellow ones.",http://boards.4chan.org/bant/thread/17928132/manlet-pajeets-stealing-polish-women#p17928163,manlet_pajeets_stealing_Polish_women
"Jun-23-2023, 07:05:15","they have higher iq, richer countries and more history than your nation you literally go to their country to work slave jobs and your women are all prostitutes there  what makes you think you're an equal, let alone superior? the reason you are considered to be negroids aside from haiti is because you have as much achievements as nigeria and as much aids as liberia you drink your life away the white negroes of europe, i feel bad for the poojets, they will probably catch diseases",http://boards.4chan.org/bant/thread/17928132/manlet-pajeets-stealing-polish-women#p17928164,manlet_pajeets_stealing_Polish_women
"Jun-23-2023, 07:07:17","almost the entire discord is bumping this thread xisters, keep it up. transgirl power!",http://boards.4chan.org/bant/thread/17928132/manlet-pajeets-stealing-polish-women#p17928165,manlet_pajeets_stealing_Polish_women
"Jun-23-2023, 07:09:31","not my fault your women are whores lmao polish men are all ugly, have alcoholic problems and usually bald by 20 you're all so fucking poor too, with 10k you're rich over there.  most polish women would rather fuck an aboriginal than you you can always turn into trannies since you seem to like them a lot",http://boards.4chan.org/bant/thread/17928132/manlet-pajeets-stealing-polish-women#p17928166,manlet_pajeets_stealing_Polish_women
"Jun-23-2023, 07:10:09","aids i forgot about that, i don't know why pooland is elevated as the white saviors, they're not even on the same level as orban.",http://boards.4chan.org/bant/thread/17928132/manlet-pajeets-stealing-polish-women#p17928167,manlet_pajeets_stealing_Polish_women
"Jun-23-2023, 07:11:30","polish women fuck everything, every third word you say is litterally whore on average. your women are such giant whores, that your whole society is centered around whoreism.",http://boards.4chan.org/bant/thread/17928132/manlet-pajeets-stealing-polish-women#p17928168,manlet_pajeets_stealing_Polish_women
"Jun-23-2023, 07:11:57","so true sister, you are valid and you will have sex one day",http://boards.4chan.org/bant/thread/17928132/manlet-pajeets-stealing-polish-women#p17928169,manlet_pajeets_stealing_Polish_women
"Jun-23-2023, 07:14:54","look at the polish girl ""raped"" in greece by pakis, she had a boyfriend of 9 years and was also a escort lmao average polish whore",http://boards.4chan.org/bant/thread/17928132/manlet-pajeets-stealing-polish-women#p17928170,manlet_pajeets_stealing_Polish_women
"Jun-23-2023, 07:15:04",so much seething in the youtube comment section damn,http://boards.4chan.org/bant/thread/17928132/manlet-pajeets-stealing-polish-women#p17928171,manlet_pajeets_stealing_Polish_women
"Jun-23-2023, 07:15:34",fake the girls are cheap paid models in most cases next,http://boards.4chan.org/bant/thread/17928132/manlet-pajeets-stealing-polish-women#p17928172,manlet_pajeets_stealing_Polish_women
"Jun-23-2023, 07:16:27","the polish whores who fuck pajeets aren't attracted to their greasy shit-colored skin, their fugly facial features, or their tiny dicks. they're attracted to their wallets, plain and simple. pajeet techies now have disposable income and like most south and east asian's they're downright stupid with it. all a white whore has to do is bat her eyelashes a little and promise bobs at the end of the night and horny little pajeet opens his wallet and the whore gets a major payday.",http://boards.4chan.org/bant/thread/17928132/manlet-pajeets-stealing-polish-women#p17928173,manlet_pajeets_stealing_Polish_women
"Jun-23-2023, 07:16:50","""picking up polish girls!"" step 1: hire polish whore using the money that your family made from selling the farm to send you to school in a non-shithole country  step 2: attempt to find condom that fits your below-average cock step 3: try to last more than 3 minutes (always get your money's worth- tuition still isn't cheap!) there you have it, you are officially a hindi chad that feels superior already from simply touching white skin",http://boards.4chan.org/bant/thread/17928132/manlet-pajeets-stealing-polish-women#p17928174,manlet_pajeets_stealing_Polish_women
"Jun-23-2023, 07:17:04","our brothels are filled with polish milf whores, most of them are married with childreen over in poland. they are just ""working"" here in germany.",http://boards.4chan.org/bant/thread/17928132/manlet-pajeets-stealing-polish-women#p17928175,manlet_pajeets_stealing_Polish_women
"Jun-23-2023, 07:18:53",staged,http://boards.4chan.org/bant/thread/17928132/manlet-pajeets-stealing-polish-women#p17928176,manlet_pajeets_stealing_Polish_women
"Jun-23-2023, 07:21:04",wtf i thought poland was the savior of the white race?,http://boards.4chan.org/bant/thread/17928132/manlet-pajeets-stealing-polish-women#p17928177,manlet_pajeets_stealing_Polish_women
"Jun-23-2023, 07:22:13",lmao. this poopjeet ain't picking up shit but hookers,http://boards.4chan.org/bant/thread/17928132/manlet-pajeets-stealing-polish-women#p17928178,manlet_pajeets_stealing_Polish_women
"Jun-23-2023, 07:24:23",is this staged too? https://youtu.be/tpwh6aeq3n0,http://boards.4chan.org/bant/thread/17928132/manlet-pajeets-stealing-polish-women#p17928179,manlet_pajeets_stealing_Polish_women
"Jun-23-2023, 07:24:39",you wanted nato and the west. that's what you get. learn to love it 'cause it ain't changing.,http://boards.4chan.org/bant/thread/17928132/manlet-pajeets-stealing-polish-women#p17928180,manlet_pajeets_stealing_Polish_women
"Jun-23-2023, 07:24:52","or get together with shitskins for 10-20k just so they could get an eu passport. many such cases, bro.",http://boards.4chan.org/bant/thread/17928132/manlet-pajeets-stealing-polish-women#p17928181,manlet_pajeets_stealing_Polish_women
"Jun-23-2023, 07:26:06","yeah, very obviously so",http://boards.4chan.org/bant/thread/17928132/manlet-pajeets-stealing-polish-women#p17928182,manlet_pajeets_stealing_Polish_women
"Jun-23-2023, 07:27:50",streetshitter are wealthier than polniggers kek the absolute state,http://boards.4chan.org/bant/thread/17928132/manlet-pajeets-stealing-polish-women#p17928183,manlet_pajeets_stealing_Polish_women
"Jun-23-2023, 07:29:05","my brother is as white as an albino but asian, i flick his ear he goes red lol.",http://boards.4chan.org/bant/thread/17928132/manlet-pajeets-stealing-polish-women#p17928184,manlet_pajeets_stealing_Polish_women
"Jun-23-2023, 07:29:29","yeah, i guess is common for polish women to have a job and become a prostitute on the side in western nations i wonder how many of them are married but then suck dick for only 50€",http://boards.4chan.org/bant/thread/17928132/manlet-pajeets-stealing-polish-women#p17928185,manlet_pajeets_stealing_Polish_women
"Jun-23-2023, 07:30:04",neither white nor black is the norm your on the same level as homosexuals.,http://boards.4chan.org/bant/thread/17928132/manlet-pajeets-stealing-polish-women#p17928186,manlet_pajeets_stealing_Polish_women
"Jun-23-2023, 07:30:37",offers 1 on 1 coaching another pajeet scam,http://boards.4chan.org/bant/thread/17928132/manlet-pajeets-stealing-polish-women#p17928187,manlet_pajeets_stealing_Polish_women
"Jun-23-2023, 07:32:02",99% scammers are my brother is included.,http://boards.4chan.org/bant/thread/17928132/manlet-pajeets-stealing-polish-women#p17928188,manlet_pajeets_stealing_Polish_women
"Jun-23-2023, 07:32:34",suck dick for only 50€  only 50€ dick sucking is 20€ sex is 30€,http://boards.4chan.org/bant/thread/17928132/manlet-pajeets-stealing-polish-women#p17928189,manlet_pajeets_stealing_Polish_women
"Jun-23-2023, 07:32:35","no offense but polish ""men"" just collectively seem like cucks. the kind of ""men"" who would work themselves to death just to buy their hateful whore wives unnecessary consumer products. even western men are savvier than that.",http://boards.4chan.org/bant/thread/17928132/manlet-pajeets-stealing-polish-women#p17928190,manlet_pajeets_stealing_Polish_women
"Jun-23-2023, 07:33:44",*are white,http://boards.4chan.org/bant/thread/17928132/manlet-pajeets-stealing-polish-women#p17928191,manlet_pajeets_stealing_Polish_women
"Jun-23-2023, 07:33:56","just accept it, anon. indian men are more manly and successful in society than us white guys. it's only natural for white women to belong to indian men.",http://boards.4chan.org/bant/thread/17928132/manlet-pajeets-stealing-polish-women#p17928192,manlet_pajeets_stealing_Polish_women
"Jun-23-2023, 07:34:27",i see the bunkertroons are spamming interracial shit again.,http://boards.4chan.org/bant/thread/17928132/manlet-pajeets-stealing-polish-women#p17928193,manlet_pajeets_stealing_Polish_women
"Jun-23-2023, 07:35:39","i agree, they should allow there selves for genetic testing at the least at least can do that for humanity?",http://boards.4chan.org/bant/thread/17928132/manlet-pajeets-stealing-polish-women#p17928194,manlet_pajeets_stealing_Polish_women
"Jun-23-2023, 07:36:08",can any poles explain to me why your woman are so unloyal to their own ppl?  literally the niggers of europe.,http://boards.4chan.org/bant/thread/17928132/manlet-pajeets-stealing-polish-women#p17928195,manlet_pajeets_stealing_Polish_women
"Jun-23-2023, 07:37:20",pick up artists in west are already kind of like a scam so a pajeet pickup artist with slavs involved? nah fuck off,http://boards.4chan.org/bant/thread/17928132/manlet-pajeets-stealing-polish-women#p17928196,manlet_pajeets_stealing_Polish_women
"Jun-23-2023, 07:37:38","never seen polish men but i've seen ukranians and russians a lot back in the day and that description fits them a lot, it was the first thing i noticed because the men looked like homeless but their women were full of trinkets.",http://boards.4chan.org/bant/thread/17928132/manlet-pajeets-stealing-polish-women#p17928197,manlet_pajeets_stealing_Polish_women
"Jun-23-2023, 07:38:46",they have the same gynocentric/matriarchal culture i think.,http://boards.4chan.org/bant/thread/17928132/manlet-pajeets-stealing-polish-women#p17928198,manlet_pajeets_stealing_Polish_women
"Jun-23-2023, 07:39:11",just at look at how much gold is hidden under the buckingham palace all stolen by white people.,http://boards.4chan.org/bant/thread/17928132/manlet-pajeets-stealing-polish-women#p17928199,manlet_pajeets_stealing_Polish_women
"Jun-23-2023, 07:40:57",lives in the uk doesn't speak english ok sar,http://boards.4chan.org/bant/thread/17928132/manlet-pajeets-stealing-polish-women#p17928200,manlet_pajeets_stealing_Polish_women
"Jun-23-2023, 07:42:50","you will never be british or white, paki.",http://boards.4chan.org/bant/thread/17928132/manlet-pajeets-stealing-polish-women#p17928201,manlet_pajeets_stealing_Polish_women
"Jun-23-2023, 07:49:25",same thing happens in romanian cities. romanian men remind women of their fat alcoholic chain smoking fathers.,http://boards.4chan.org/bant/thread/17928132/manlet-pajeets-stealing-polish-women#p17928202,manlet_pajeets_stealing_Polish_women
"Jun-23-2023, 07:53:53",can you tell pajeets and gypsies apart?,http://boards.4chan.org/bant/thread/17928132/manlet-pajeets-stealing-polish-women#p17928203,manlet_pajeets_stealing_Polish_women
"Jun-23-2023, 07:57:18","yes, usually by phenotype, gypsies are bleached. some gypsies look like pure blooded tamil, but in this case, the fashion sense and mannerisms make them distinguishable.",http://boards.4chan.org/bant/thread/17928132/manlet-pajeets-stealing-polish-women#p17928204,manlet_pajeets_stealing_Polish_women
"Jun-23-2023, 07:57:48",ew you fucked a pole,http://boards.4chan.org/bant/thread/17928132/manlet-pajeets-stealing-polish-women#p17928205,manlet_pajeets_stealing_Polish_women
"Jun-23-2023, 07:58:41","romanian women usually form couples with arabs, not pajeets, because the latter remind them of gypsies. romanian women also fetishize dark italians and iberians, which is weird, because we're only slightly whiter than them.",http://boards.4chan.org/bant/thread/17928132/manlet-pajeets-stealing-polish-women#p17928206,manlet_pajeets_stealing_Polish_women
"Jun-23-2023, 07:58:43",fucking russians!,http://boards.4chan.org/bant/thread/17928132/manlet-pajeets-stealing-polish-women#p17928207,manlet_pajeets_stealing_Polish_women
"Jun-23-2023, 08:00:10",no i speak albinism can you translate for me please?,http://boards.4chan.org/bant/thread/17928132/manlet-pajeets-stealing-polish-women#p17928208,manlet_pajeets_stealing_Polish_women
"Jun-23-2023, 08:01:15",it likely has nothing to do with skin color but with the fact that you are cucks.,http://boards.4chan.org/bant/thread/17928132/manlet-pajeets-stealing-polish-women#p17928209,manlet_pajeets_stealing_Polish_women
"Jun-23-2023, 08:01:31","take your meds jose, you are spazzing out again",http://boards.4chan.org/bant/thread/17928132/manlet-pajeets-stealing-polish-women#p17928210,manlet_pajeets_stealing_Polish_women
"Jun-23-2023, 08:01:39","gladly not white but my brother is and he talks about suicide 24/7 so thank god i am tanned, you on the other hand are a god foresaken albino.",http://boards.4chan.org/bant/thread/17928132/manlet-pajeets-stealing-polish-women#p17928211,manlet_pajeets_stealing_Polish_women
"Jun-23-2023, 08:02:03",this wouldn’t have happened if lewandisney wasn’t a fraud.,http://boards.4chan.org/bant/thread/17928132/manlet-pajeets-stealing-polish-women#p17928212,manlet_pajeets_stealing_Polish_women
"Jun-23-2023, 08:03:24","stop replying to garbage slide threads, you stupid niggercattle  stop replying to garbage slide threads, you stupid niggercattle   stop replying to garbage slide threads, you stupid niggercattle  stop replying to garbage slide threads, you stupid niggercattle   stop replying to garbage slide threads, you stupid niggercattle  stop replying to garbage slide threads, you stupid niggercattle   stop replying to garbage slide threads, you stupid niggercattle  stop replying to garbage slide threads, you stupid niggercattle   stop replying to garbage slide threads, you stupid niggercattle  stop replying to garbage slide threads, you stupid niggercattle   stop replying to garbage slide threads, you stupid niggercattle  stop replying to garbage slide threads, you stupid niggercattle   stop replying to garbage slide threads, you stupid niggercattle  stop replying to garbage slide threads, you stupid niggercattle   stop replying to garbage slide threads, you stupid niggercattle  stop replying to garbage slide threads, you stupid niggercattle   stop replying to garbage slide threads, you stupid niggercattle  stop replying to garbage slide threads, you stupid niggercattle   stop replying to garbage slide threads, you stupid niggercattle  stop replying to garbage slide threads, you stupid niggercattle   stop replying to garbage slide threads, you stupid niggercattle  stop replying to garbage slide threads, you stupid niggercattle",http://boards.4chan.org/bant/thread/17928132/manlet-pajeets-stealing-polish-women#p17928213,manlet_pajeets_stealing_Polish_women
"Jun-23-2023, 08:03:31","gay ass haircut cheesy neck tattoos gauges lmao even your refugees copy americans. europe is truly dead, your youth just copy everything our youth do anyway, from street shitters to niggers, no one can escape the american cultural singularity event horizon. once your country gets close to american influence, it will get pulled into an inescapable sinking effect.",http://boards.4chan.org/bant/thread/17928132/manlet-pajeets-stealing-polish-women#p17928214,manlet_pajeets_stealing_Polish_women
"Jun-23-2023, 08:04:03",how come you live in the uk and can't speak proper english?,http://boards.4chan.org/bant/thread/17928132/manlet-pajeets-stealing-polish-women#p17928215,manlet_pajeets_stealing_Polish_women
"Jun-23-2023, 08:04:14","you're not ""tanned"". you're feces given a roughly human shape and the power of speech.",http://boards.4chan.org/bant/thread/17928132/manlet-pajeets-stealing-polish-women#p17928216,manlet_pajeets_stealing_Polish_women
"Jun-23-2023, 08:04:45",no one can escape the american cultural singularity event horizon. when i saw the blm protests in europe i gave up on this gay continent.,http://boards.4chan.org/bant/thread/17928132/manlet-pajeets-stealing-polish-women#p17928217,manlet_pajeets_stealing_Polish_women
"Jun-23-2023, 08:06:18",should i show you my brother maybe you can identify what type of albino he is? maybe we can study why can be asian but have albino skin tone at the same time?,http://boards.4chan.org/bant/thread/17928132/manlet-pajeets-stealing-polish-women#p17928218,manlet_pajeets_stealing_Polish_women
"Jun-23-2023, 08:06:27",,http://boards.4chan.org/bant/thread/17928132/manlet-pajeets-stealing-polish-women#p17928219,manlet_pajeets_stealing_Polish_women
"Jun-23-2023, 08:06:38",his eyes are kinda smol,http://boards.4chan.org/bant/thread/17928132/manlet-pajeets-stealing-polish-women#p17928220,manlet_pajeets_stealing_Polish_women
